{
  "name": "Downtown Grid",
  "description": "Medium difficulty - Navigate city blocks and one-way streets",
  "grid_size": 15,
  "max_battery": 22,
  "starting_battery": 22,
  "layout": [
    "BBBBBBBBBBBBBBB",
    "BPRRRRRRRRRRRSB",
    "BRBBBRBBBRBBBBB",
    "BRRRBPRBRPBRRBB",
    "BRBBBRBBBRBBBBB",
    "BRRRRRRRRRRRRBB",
    "BBBBBRRRRRBBBBB",
    "BSRRRHHHHHRRRPB",
    "BBBBBRRRRRBBBBB",
    "BRRRRRRRRRRRRBB",
    "BRBBBRBBBRBBBBB",
    "BRRPBRRBRRBRRBB",
    "BRBBBRBBBRBBBBB",
    "BSRRRRRRRRRPRBB",
    "BBBBBBBBBBBBBBB"
  ],
  "legend": {
    "R": "road",
    "H": "home",
    "P": "park",
    "S": "supercharger",
    "W": "water",
    "B": "building"
  },
  "wall_crash_ends_game": true,
  "messages": {
    "welcome": "Welcome to downtown! Navigate the city grid to find all parks!",
    "home_charge": "Parking garage charger! Battery full!",
    "supercharger_charge": "Street supercharger! Battery charged!",
    "park_visited": "City park found! Score: %d",
    "park_already_visited": "Already visited this city park",
    "victory": "City tour complete! All %d parks visited!",
    "out_of_battery": "Out of charge downtown!",
    "stranded": "Stuck in traffic with no battery! Game Over!",
    "cant_move": "That's a building!",
    "battery_status": "Battery: %d/%d",
    "hit_wall": "You crashed into a building! Game Over!"
  }
}