{
  "name": "Classic Layout",
  "description": "The original Tesla Road Trip game layout",
  "grid_size": 15,
  "max_battery": 20,
  "starting_battery": 20,
  "layout": [
    "BBBWBBBPBBBWBBB",
    "BRRRRRRRRRRRRRB",
    "BRBBBRRSRBBBRPB",
    "BRBPBRRRRRBPBRB",
    "BRBRBBBRBBBRBBB",
    "BRRRRRRRRRRRRRB",
    "BBBBRWWWWWBBBBB",
    "PRRRRHHHHHRRRRP",
    "BBBBRWWWWWBBBBB",
    "BRRRRRRRRRRRRRB",
    "BRBRBBBRBBBRBBB",
    "BRBPBRRRRRBPBRB",
    "BRBBBRRSRBBBRPB",
    "BRRRRRRRRRRRRRB",
    "BBBWBBBPBBBWBBB"
  ],
  "legend": {
    "R": "road",
    "H": "home",
    "P": "park",
    "S": "supercharger",
    "W": "water",
    "B": "building"
  },
  "wall_crash_ends_game": true,
  "messages": {
    "welcome": "Welcome! Drive your Tesla to collect parks. Watch your battery!",
    "home_charge": "Home sweet home! Battery fully charged!",
    "supercharger_charge": "Supercharger! Battery fully charged!",
    "park_visited": "Park visited! Score: %d",
    "park_already_visited": "Already visited this park",
    "victory": "Victory! All %d parks visited!",
    "out_of_battery": "Out of battery! Game Over!",
    "stranded": "Stranded with no battery! Game Over!",
    "cant_move": "Can't move there!",
    "battery_status": "Battery: %d/%d",
    "hit_wall": "You crashed into a wall! Game Over!"
  }
}