{
  "name": "strategic",
  "description": "The 16x16 Strategic Maze with 5 parks - our main challenge puzzle",
  "grid_size": 16,
  "max_battery": 22,
  "starting_battery": 22,
  "layout": [
    "BBBBBBBBBBBBBBBB",
    "BPRRRSBBBBRRRRRB",
    "BRBBRRBBBBRRBBRB",
    "BRBBRRRRRRRRBBRB",
    "BRBBBBBRRBBBBBRB",
    "BRRRRRRRRRRRRRRB",
    "BBBRBBBRRBBBRBBB",
    "BPRRBBRHHBBRRRSB",
    "BBRRBBRHHBBRRBBB",
    "BBRRBBRRRBBRRBBB",
    "BRRRRRRRRRRRRRRB",
    "BRBBBBBRRBBBBBRB",
    "BRBBRRRRRRRRBBRB",
    "BRBBRRBSSBRRBBRB",
    "BPRRRRBBBBRRRRRB",
    "BBBBBBBBBBBBBBBB"
  ],
  "legend": {
    "B": "building",
    "H": "home",
    "P": "park",
    "R": "road",
    "S": "supercharger",
    "W": "water"
  },
  "wall_crash_ends_game": true,
  "messages": {
    "welcome": "Welcome to strategic!",
    "home_charge": "Home sweet home! Battery fully charged!",
    "supercharger_charge": "Supercharger! Battery fully charged!",
    "park_visited": "Park visited! Score: %d",
    "park_already_visited": "Already visited this park",
    "victory": "Excellent! All %d parks visited!",
    "out_of_battery": "Battery depleted! Try again!",
    "stranded": "No battery left! Game Over!",
    "cant_move": "Can't go there!",
    "battery_status": "Battery: %d/%d",
    "hit_wall": "You crashed into a wall! Game Over!"
  }
}