{
  "name": "Circuit Track Easy",
  "description": "Easy circular track with strategic charging points",
  "grid_size": 14,
  "max_battery": 18,
  "starting_battery": 18,
  "layout": [
    "BBBBBBBBBBBBBB",
    "BPRRRRRRRRRRPB",
    "BRBBBBRBBBBRRB",
    "BRBBWWRWWBBRPB",
    "BRBWWWRWWWBRBB",
    "BRBWWHHHWWBRSB",
    "BSBWWHHHWWBRBB",
    "BRBWWHHHWWBRBB",
    "BRBWWWRWWWBRSB",
    "BRBBBWRWBBBRBB",
    "BPRBBBRBBBBRPB",
    "BRRRRRRRRRRRRB",
    "BPRRRSRRRRRPBB",
    "BBBBBBBBBBBBBB"
  ],
  "legend": {
    "R": "road",
    "H": "home",
    "P": "park",
    "S": "supercharger",
    "W": "water",
    "B": "building"
  },
  "wall_crash_ends_game": true,
  "messages": {
    "welcome": "Welcome to Circuit Track! Navigate the loop to collect all 6 parks!",
    "home_charge": "Pit stop at home! Battery fully charged!",
    "supercharger_charge": "Quick charge! Battery fully charged!",
    "park_visited": "Park checkpoint! Score: %d",
    "park_already_visited": "Already visited this park",
    "victory": "Circuit complete! All %d parks visited!",
    "out_of_battery": "Battery depleted! Race Over!",
    "stranded": "Stranded on track! Game Over!",
    "cant_move": "Track blocked!",
    "battery_status": "Battery: %d/%d",
    "hit_wall": "You crashed into a wall! Game Over!"
  }
}