{
  "name": "Easy Mode",
  "description": "Beginner-friendly layout with more superchargers",
  "grid_size": 10,
  "max_battery": 15,
  "starting_battery": 15,
  "layout": [
    "BBBBBBBBBB",
    "BRRRRSRRRB",
    "BRPRRRRPRB",
    "BRRRHHRRRB",
    "BSRHHHHRBB",
    "BRRHHHRRBB",
    "BRRRRRRRBB",
    "BRPRRRRPRB",
    "BRRRRSRRRB",
    "BBBBBBBBBB"
  ],
  "legend": {
    "R": "road",
    "H": "home",
    "P": "park",
    "S": "supercharger",
    "W": "water",
    "B": "building"
  },
  "wall_crash_ends_game": true,
  "messages": {
    "welcome": "Welcome to Easy Mode! Plenty of charging stations await!",
    "home_charge": "Home sweet home! Battery fully charged!",
    "supercharger_charge": "Supercharger! Battery fully charged!",
    "park_visited": "Park visited! Score: %d",
    "park_already_visited": "Already visited this park",
    "victory": "Excellent! All %d parks visited!",
    "out_of_battery": "Battery depleted! Try again!",
    "stranded": "No battery left! Game Over!",
    "cant_move": "Can't go there!",
    "battery_status": "Battery: %d/%d",
    "hit_wall": "You crashed into a wall! Game Over!"
  }
}